{
  "@timestamp": "2026-07-16T00:00:00Z",
  "event": {
    "action": "ai_tool_executed",
    "category": [
      "configuration"
    ],
    "dataset": "watchmyai.events",
    "id": "evt-wmai-042-benign-000",
    "kind": "event",
    "provider": "watchmyai",
    "type": [
      "change"
    ]
  },
  "host": {
    "name": "lab-host"
  },
  "user": {
    "name": "lab-user"
  },
  "watchmyai": {
    "agent": {
      "id": "agent-wmai-042",
      "type": "known_ai_agent"
    },
    "attribution": {
      "level": "confirmed"
    },
    "context": {
      "accessed_by_worker_id": "worker-owner",
      "owner_worker_id": "worker-owner"
    },
    "policy": {
      "violation": {
        "detected": false,
        "type": "cross_agent_context_access"
      }
    },
    "schema": {
      "version": "1.1.0"
    }
  }
}
