{
  "@timestamp": "2026-07-16T00:00:00Z",
  "event": {
    "action": "investigation_required",
    "category": [
      "configuration"
    ],
    "dataset": "watchmyai.events",
    "id": "evt-wmai-049-benign-000",
    "kind": "event",
    "provider": "watchmyai",
    "type": [
      "change"
    ]
  },
  "host": {
    "name": "lab-host"
  },
  "user": {
    "name": "lab-user"
  },
  "watchmyai": {
    "agent": {
      "id": "agent-lab",
      "type": "known_ai_agent"
    },
    "attribution": {
      "level": "confirmed"
    },
    "investigation": {
      "risk_score": 10,
      "status": "closed"
    },
    "schema": {
      "version": "1.1.0"
    }
  }
}
