{
  "@timestamp": "2026-07-16T00:00:00Z",
  "event": {
    "action": "ai_tool_executed",
    "category": [
      "configuration"
    ],
    "dataset": "watchmyai.events",
    "id": "evt-wmai-031-benign-000",
    "kind": "event",
    "provider": "watchmyai",
    "type": [
      "change"
    ]
  },
  "host": {
    "name": "lab-host"
  },
  "threat": {
    "indicator": {
      "ip": "203.0.113.77",
      "url": {
        "full": "https://risk.example.test/payload"
      }
    }
  },
  "user": {
    "name": "lab-user"
  },
  "watchmyai": {
    "agent": {
      "id": "agent-wmai-031",
      "type": "known_ai_agent"
    },
    "attribution": {
      "level": "confirmed"
    },
    "policy": {
      "violation": {
        "detected": false,
        "type": "connection_to_high_risk_destination"
      }
    },
    "schema": {
      "version": "1.1.0"
    }
  }
}
