{
  "@timestamp": "2026-07-16T00:00:00Z",
  "event": {
    "action": "context_changed",
    "category": [
      "configuration"
    ],
    "dataset": "watchmyai.events",
    "id": "evt-wmai-037-benign-000",
    "kind": "event",
    "provider": "watchmyai",
    "type": [
      "change"
    ]
  },
  "host": {
    "name": "lab-host"
  },
  "user": {
    "name": "lab-user"
  },
  "watchmyai": {
    "agent": {
      "id": "agent-lab",
      "type": "known_ai_agent"
    },
    "attribution": {
      "level": "confirmed"
    },
    "context": {
      "poisoning_indicator": false,
      "provenance": "file:///lab/approved-context.md",
      "trust_status": "trusted"
    },
    "schema": {
      "version": "1.1.0"
    }
  }
}
