{
  "@timestamp": "2026-07-16T00:00:00Z",
  "event": {
    "action": "policy_violation",
    "category": [
      "configuration"
    ],
    "dataset": "watchmyai.events",
    "id": "evt-wmai-047-malicious-000",
    "kind": "alert",
    "provider": "watchmyai",
    "type": [
      "change"
    ]
  },
  "host": {
    "name": "lab-host"
  },
  "user": {
    "name": "lab-user"
  },
  "watchmyai": {
    "action": {
      "sequence": 2
    },
    "agent": {
      "id": "agent-wmai-047",
      "type": "known_ai_agent"
    },
    "attribution": {
      "level": "confirmed"
    },
    "policy": {
      "violation": {
        "detected": true,
        "type": "multi_stage_attack_chain_correlated"
      }
    },
    "schema": {
      "version": "1.1.0"
    },
    "session": {
      "id": "session-wmai-047"
    }
  }
}
