{
  "@timestamp": "2026-07-16T00:00:00Z",
  "event": {
    "action": "evidence_evaluated",
    "category": [
      "configuration"
    ],
    "dataset": "watchmyai.events",
    "id": "evt-wmai-046-benign-000",
    "kind": "event",
    "provider": "watchmyai",
    "type": [
      "change"
    ]
  },
  "host": {
    "name": "lab-host"
  },
  "user": {
    "name": "lab-user"
  },
  "watchmyai": {
    "agent": {
      "id": "agent-lab",
      "type": "known_ai_agent"
    },
    "attribution": {
      "level": "confirmed"
    },
    "evidence": {
      "complete": true,
      "present_ids": [
        "wmai-046-evidence-1",
        "wmai-046-evidence-2"
      ],
      "required_ids": [
        "wmai-046-evidence-1",
        "wmai-046-evidence-2"
      ]
    },
    "schema": {
      "version": "1.1.0"
    }
  }
}
